{
  "version": "uiux-handoff.v1",
  "product": "Example Request Portal",
  "scope": "Create a request from dashboard to confirmation.",
  "platforms": [
    "responsive_web"
  ],
  "assumptions": [
    {
      "id": "A-001",
      "statement": "Users are authenticated before starting the flow.",
      "impact": "Login screens are out of scope."
    }
  ],
  "open_questions": [
    {
      "id": "Q-001",
      "question": "Should users be able to attach multiple files?",
      "impact": "Affects attachment component and validation.",
      "owner": "Product"
    }
  ],
  "roles": [
    {
      "id": "ROLE-001",
      "name": "Requester",
      "goals": [
        "Create and track requests"
      ],
      "permissions": [
        "create_request",
        "view_own_requests"
      ]
    }
  ],
  "requirements": [
    {
      "id": "REQ-001",
      "summary": "Requester can create a new request.",
      "type": "functional",
      "priority": "must"
    },
    {
      "id": "REQ-002",
      "summary": "Requester can review before submitting.",
      "type": "functional",
      "priority": "must"
    }
  ],
  "flows": [
    {
      "id": "FLOW-001",
      "name": "Create request",
      "actor_role_id": "ROLE-001",
      "trigger": "Requester selects New request from dashboard.",
      "entry_screen_id": "SCR-001",
      "steps": [
        {
          "order": 1,
          "screen_id": "SCR-001",
          "user_action": "Select New request.",
          "system_response": "Display request details form.",
          "next_screen_id": "SCR-002",
          "requirement_ids": [
            "REQ-001"
          ]
        },
        {
          "order": 2,
          "screen_id": "SCR-002",
          "user_action": "Enter required details and select Continue.",
          "system_response": "Validate input and show review screen.",
          "next_screen_id": "SCR-003",
          "requirement_ids": [
            "REQ-001",
            "REQ-002"
          ]
        },
        {
          "order": 3,
          "screen_id": "SCR-003",
          "user_action": "Review and submit.",
          "system_response": "Create request and show confirmation.",
          "next_screen_id": "SCR-004",
          "requirement_ids": [
            "REQ-002"
          ]
        }
      ],
      "alternate_paths": [
        {
          "name": "Save draft",
          "starts_at_screen_id": "SCR-002",
          "result": "Draft saved and requester returns to dashboard."
        }
      ],
      "exception_paths": [
        {
          "name": "Validation error",
          "starts_at_screen_id": "SCR-002",
          "result": "Inline errors appear and focus moves to error summary."
        }
      ],
      "exit_criteria": "Requester receives confirmation number."
    }
  ],
  "screens": [
    {
      "id": "SCR-001",
      "name": "Dashboard",
      "purpose": "Help requester see recent requests and start a new one.",
      "user_goal": "Start a request quickly.",
      "entry_points": [
        "Login success"
      ],
      "exit_points": [
        "SCR-002"
      ],
      "layout_summary": "Header with primary action, status summary, recent requests list.",
      "primary_action": {
        "label": "New request",
        "destination": "SCR-002"
      },
      "secondary_actions": [
        {
          "label": "View all requests",
          "destination": "SCR-005"
        }
      ],
      "components": [
        "CMP-001",
        "CMP-002"
      ],
      "content": {
        "title": "Requests",
        "empty_state": "No requests yet. Start by creating your first request."
      },
      "data_inputs": [],
      "data_outputs": [
        {
          "name": "recent_requests",
          "source": "GET /requests?limit=5"
        }
      ],
      "validations": [],
      "states": [
        "default",
        "loading",
        "empty",
        "error"
      ],
      "accessibility": {
        "focus_order": "Page title, New request, filters, request rows",
        "notes": "Status badges include text labels and do not rely on color alone."
      },
      "analytics_events": [
        "EVT-001"
      ],
      "api_or_data_dependencies": [
        {
          "name": "recent requests",
          "endpoint": "GET /requests?limit=5"
        }
      ],
      "requirement_ids": [
        "REQ-001"
      ],
      "acceptance_criteria": [
        "AC-001"
      ],
      "visual": {
        "hierarchy": "1) New request primary button, 2) status summary cards, 3) recent requests table.",
        "emphasis_tokens": "neutral surface; primary accent only on the New request action; status via badge color+label.",
        "density": "comfortable"
      },
      "motion": {
        "transitions": "Cards and table fade/slide in on load (opacity+transform, ease-out, base).",
        "loading_treatment": "skeleton cards and skeleton table rows",
        "reduced_motion": "Show content immediately without slide; no fade."
      }
    },
    {
      "id": "SCR-002",
      "name": "Request details",
      "purpose": "Capture the minimum information required to create a request.",
      "user_goal": "Provide details without confusion.",
      "entry_points": [
        "SCR-001"
      ],
      "exit_points": [
        "SCR-003",
        "SCR-001"
      ],
      "layout_summary": "Single-column form grouped into requester details and request details.",
      "primary_action": {
        "label": "Continue to review",
        "destination": "SCR-003"
      },
      "secondary_actions": [
        {
          "label": "Save draft",
          "destination": "SCR-001"
        },
        {
          "label": "Cancel",
          "destination": "SCR-001"
        }
      ],
      "components": [
        "CMP-003",
        "CMP-004"
      ],
      "content": {
        "title": "Request details",
        "helper": "Provide the details needed to route your request."
      },
      "data_inputs": [
        {
          "name": "request_title",
          "required": true
        },
        {
          "name": "description",
          "required": true
        }
      ],
      "data_outputs": [],
      "validations": [
        {
          "id": "VAL-001",
          "field": "request_title",
          "rule": "Required, max 100 characters",
          "message": "Enter a request title."
        }
      ],
      "states": [
        "default",
        "saving",
        "validation_error",
        "system_error"
      ],
      "accessibility": {
        "focus_order": "Error summary, title, description, attachments, actions",
        "notes": "Errors are linked to fields and announced after validation."
      },
      "analytics_events": [
        "EVT-002",
        "EVT-003"
      ],
      "api_or_data_dependencies": [
        {
          "name": "save draft",
          "endpoint": "POST /request-drafts"
        }
      ],
      "requirement_ids": [
        "REQ-001"
      ],
      "acceptance_criteria": [
        "AC-002"
      ],
      "visual": {
        "hierarchy": "1) Section/field labels and inputs, 2) Continue primary action, 3) Save draft secondary (ghost).",
        "emphasis_tokens": "single-column form on surface; danger token only for validation errors; primary on Continue.",
        "density": "comfortable"
      },
      "motion": {
        "transitions": "Inline error messages animate in (fast, ease-out); button \u2192 saving \u2192 state change.",
        "loading_treatment": "button loading state on Continue/Save draft",
        "reduced_motion": "Errors appear without animation; button state changes without spinner motion."
      }
    },
    {
      "id": "SCR-003",
      "name": "Review request",
      "purpose": "Let requester verify information before submission.",
      "user_goal": "Confirm details are correct.",
      "entry_points": [
        "SCR-002"
      ],
      "exit_points": [
        "SCR-004",
        "SCR-002"
      ],
      "layout_summary": "Read-only summary sections with edit links.",
      "primary_action": {
        "label": "Submit request",
        "destination": "SCR-004"
      },
      "secondary_actions": [
        {
          "label": "Edit details",
          "destination": "SCR-002"
        }
      ],
      "components": [
        "CMP-005"
      ],
      "content": {
        "title": "Review your request",
        "warning": "You can edit details before submitting."
      },
      "data_inputs": [],
      "data_outputs": [
        {
          "name": "draft_summary",
          "source": "draft state"
        }
      ],
      "validations": [
        {
          "id": "VAL-002",
          "field": "draft",
          "rule": "Draft must pass all validations before submit",
          "message": "Fix the highlighted details before submitting."
        }
      ],
      "states": [
        "default",
        "submitting",
        "validation_error",
        "system_error"
      ],
      "accessibility": {
        "focus_order": "Title, summary sections, edit links, submit",
        "notes": "Edit links include section name in accessible label."
      },
      "analytics_events": [
        "EVT-004"
      ],
      "api_or_data_dependencies": [
        {
          "name": "submit",
          "endpoint": "POST /requests"
        }
      ],
      "requirement_ids": [
        "REQ-002"
      ],
      "acceptance_criteria": [
        "AC-003"
      ]
    },
    {
      "id": "SCR-004",
      "name": "Confirmation",
      "purpose": "Confirm successful submission and give next steps.",
      "user_goal": "Know the request was created and what happens next.",
      "entry_points": [
        "SCR-003"
      ],
      "exit_points": [
        "SCR-001",
        "SCR-005"
      ],
      "layout_summary": "Success message, confirmation number, next actions.",
      "primary_action": {
        "label": "View request",
        "destination": "SCR-005"
      },
      "secondary_actions": [
        {
          "label": "Back to dashboard",